{
  "schema_version": 1,
  "id": "forest_camp",
  "name": "Лесной лагерь",
  "description": "Тропа, поляна и заросли. Камни дают укрытие, кусты замедляют движение.",
  "rows": [
    "############",
    "#...~~.....#",
    "#...~~..#..#",
    "#..........#",
    "#..##......#",
    "#..........#",
    "#.....~~...#",
    "############"
  ],
  "zones": [
    {
      "id": "entrance",
      "name": "Вход",
      "cells": [
        [
          1,
          1
        ],
        [
          2,
          1
        ],
        [
          1,
          2
        ],
        [
          2,
          2
        ],
        [
          1,
          3
        ],
        [
          2,
          3
        ],
        [
          1,
          4
        ],
        [
          2,
          4
        ],
        [
          1,
          5
        ],
        [
          2,
          5
        ],
        [
          1,
          6
        ],
        [
          2,
          6
        ]
      ]
    },
    {
      "id": "hall",
      "name": "Поляна",
      "cells": [
        [
          3,
          1
        ],
        [
          4,
          1
        ],
        [
          5,
          1
        ],
        [
          6,
          1
        ],
        [
          7,
          1
        ],
        [
          3,
          2
        ],
        [
          4,
          2
        ],
        [
          5,
          2
        ],
        [
          6,
          2
        ],
        [
          7,
          2
        ],
        [
          3,
          3
        ],
        [
          4,
          3
        ],
        [
          5,
          3
        ],
        [
          6,
          3
        ],
        [
          7,
          3
        ],
        [
          5,
          4
        ],
        [
          6,
          4
        ],
        [
          7,
          4
        ],
        [
          3,
          5
        ],
        [
          4,
          5
        ],
        [
          5,
          5
        ],
        [
          6,
          5
        ],
        [
          7,
          5
        ],
        [
          3,
          6
        ],
        [
          4,
          6
        ],
        [
          5,
          6
        ],
        [
          6,
          6
        ],
        [
          7,
          6
        ]
      ]
    },
    {
      "id": "counter",
      "name": "Опушка",
      "cells": [
        [
          8,
          1
        ],
        [
          9,
          1
        ],
        [
          10,
          1
        ],
        [
          9,
          2
        ],
        [
          10,
          2
        ],
        [
          8,
          3
        ],
        [
          9,
          3
        ],
        [
          10,
          3
        ],
        [
          8,
          4
        ],
        [
          9,
          4
        ],
        [
          10,
          4
        ],
        [
          8,
          5
        ],
        [
          9,
          5
        ],
        [
          10,
          5
        ],
        [
          8,
          6
        ],
        [
          9,
          6
        ],
        [
          10,
          6
        ]
      ]
    }
  ],
  "objects": [
    {
      "id": "table",
      "name": "Походный стол",
      "position": [
        4,
        3
      ],
      "posture": "upright",
      "provides_cover": false,
      "blocks_movement": true
    },
    {
      "id": "counter",
      "name": "Большой валун",
      "position": [
        9,
        3
      ],
      "posture": "fixed",
      "provides_cover": true,
      "blocks_movement": true
    }
  ],
  "spawn": [
    1,
    5
  ]
}
